Term,Definition,Aliases,Core Principle
Gegenkraft,"The action-power of intentional daily opposition of a habit — the intentional wedge that purposely sheds bad habits through deliberate denial/replacement, strategical countering or sabotage; its effectiveness tied to the law of momentum/inertia.","Opposing Power, Gk-power, gkpower, gk",Law of Momentum/Inertia
GK Move,A specific daily action designed to oppose and disrupt a target habit,Counter-move,Deliberate opposition
GK Power Level,Self-rated daily score (1-10) of one's resistance strength and commitment,Power Level,Self-awareness
Boss Battle,A day with 3 or more urges — surviving clean earns double points,High-urge day,Resilience under pressure
GK Streak,Consecutive days of completed morning declarations and logged resistance,Streak,Momentum building
